{
  "schema_version": "1.0",
  "run_id": "run_demo_1",
  "project_id": "project_demo",
  "problem_class": "python_api_optimisation",
  "artifact_description": "FastAPI authentication handler",
  "completed_at": "2026-03-22T12:00:00Z",
  "baseline_scores": {
    "composite": 0.41,
    "tracks": {
      "type_correctness": 0.63
    }
  },
  "final_scores": {
    "composite": 0.77,
    "tracks": {
      "type_correctness": 0.95
    }
  },
  "rounds_completed": 2,
  "memory_mode": "direct_backend",
  "pivots": ["minor pivot at round 1: moved to return-type-first strategy"],
  "what_worked": ["Return type annotations first for FastAPI handlers."],
  "what_failed": ["Renaming symbols before fixing types caused churn."],
  "disposition_updates_proposed": ["upd_demo_reinforce"],
  "provenance": {
    "source": "run_completion",
    "detail": "demo fixture"
  }
}
